{
  "schemaVersion": 1,
  "mode": "independent",
  "proposalHash": "sha256:bcf8fd70c45be806a0ffdf4b79924bb42e22a215813b0dcf36e6b9c9aed8901a",
  "evidenceHash": "sha256:eb5a892c23c424a759e8eb5becfab06e68e083661a9a9fcf23e2c00dd74e2908",
  "reviewer": {
    "id": "independent-reviewer-2026-07-24",
    "note": "复核者已先读原始证据和受限图谱上下文，再独立填写；未读取或推断原提案决定、理由、目标节点或分数。"
  },
  "candidates": [
    {
      "term": "agent",
      "decision": "supplement",
      "rationale": "视频以能发邮件、安排会议和退款的工具型 Agent 为例，明确展示自主工具调用在高风险操作上的控制边界，以及如何把真实待执行参数交给人确认。这是现有 AI Agent 节点关于工具风险与监督边界的具体案例。",
      "targetNode": "agent",
      "nodeScores": null,
      "coreCandidate": true,
      "coreScores": {
        "learningGateway": 4,
        "graphCentrality": 0,
        "crossRouteReuse": 4,
        "beginnerNavigation": 4,
        "stability": 4
      },
      "evidenceRefs": [
        {
          "start": 27.56,
          "end": 41.72
        },
        {
          "start": 89.269,
          "end": 115.609
        },
        {
          "start": 171.398,
          "end": 200.478
        }
      ],
      "nearestNodes": [],
      "proposedEdges": [],
      "externalSources": [],
      "claims": [],
      "proposedLearningPath": null,
      "disqualifiers": [],
      "proposedNode": null
    },
    {
      "term": "human-in-the-loop",
      "decision": "supplement",
      "rationale": "视频完整说明人在回路如何成为工具调用的强制审批门：未批准则工具无法执行；审阅消息应显示实际工具参数而非另一次模型生成值；审阅者可在聊天或外部协作渠道批准、拒绝或提供额外信息。这是现有人在回路节点的高质量实践补充。",
      "targetNode": "human-in-the-loop",
      "nodeScores": null,
      "coreCandidate": false,
      "coreScores": null,
      "evidenceRefs": [
        {
          "start": 0,
          "end": 26.56
        },
        {
          "start": 41.72,
          "end": 73.4
        },
        {
          "start": 89.269,
          "end": 167.618
        },
        {
          "start": 171.398,
          "end": 200.478
        },
        {
          "start": 232.438,
          "end": 283.827
        }
      ],
      "nearestNodes": [],
      "proposedEdges": [],
      "externalSources": [],
      "claims": [],
      "proposedLearningPath": null,
      "disqualifiers": [],
      "proposedNode": null
    },
    {
      "term": "streaming",
      "decision": "reject",
      "rationale": "Streaming 只作为聊天触发器设置界面中的字段出现，转录没有解释逐 token 返回、增量传输或流式响应机制，因此只是界面配置痕迹，不足以补充流式输出节点。",
      "targetNode": null,
      "nodeScores": null,
      "coreCandidate": false,
      "coreScores": null,
      "evidenceRefs": [],
      "nearestNodes": [],
      "proposedEdges": [],
      "externalSources": [],
      "claims": [],
      "proposedLearningPath": null,
      "disqualifiers": [
        "仅在设置界面出现",
        "缺少流式输出机制证据"
      ],
      "proposedNode": null
    }
  ]
}
