{
  "schemaVersion": 1,
  "mode": "independent",
  "proposalHash": "sha256:7cc4aee430853fd25c4075c8e7c24a3e1f56dcc7c75f1867b7d68eec68938e58",
  "evidenceHash": "sha256:09288223a0f05272c15bedff1859ca966eeba68d58680f3a12f8035413783f59",
  "reviewer": {
    "id": "independent-reviewer-2026-07-24",
    "note": "复核者已先读原始证据和受限图谱上下文，再独立填写；未读取或推断原提案决定、理由、目标节点或分数。"
  },
  "candidates": [
    {
      "term": "agent",
      "decision": "supplement",
      "rationale": "视频不只是提到 Agent，而是完整展示了聊天入口、模型、会话记忆、数据表工具、工具描述与系统消息如何组合，并通过一次多步骤执行说明 Agent 会选择并调用工具完成任务。这是现有 AI Agent 节点的可追溯实践侧面，不构成新概念。",
      "targetNode": "agent",
      "nodeScores": null,
      "coreCandidate": true,
      "coreScores": {
        "learningGateway": 4,
        "graphCentrality": 0,
        "crossRouteReuse": 4,
        "beginnerNavigation": 4,
        "stability": 4
      },
      "evidenceRefs": [
        {
          "start": 19.62,
          "end": 26.76
        },
        {
          "start": 786.76,
          "end": 848.64
        },
        {
          "start": 907.92,
          "end": 928.04
        },
        {
          "start": 1039.66,
          "end": 1060.66
        }
      ],
      "nearestNodes": [],
      "proposedEdges": [],
      "externalSources": [],
      "claims": [],
      "proposedLearningPath": null,
      "disqualifiers": [],
      "proposedNode": null
    },
    {
      "term": "工作流",
      "decision": "supplement",
      "rationale": "视频用两个相连但职责分离的流程展示工作流编排：表单触发的数据摄取流程与基于聊天触发的 Agent 流程，并解释触发器启动流程、动作执行步骤、条件分支以及每次运行产生执行记录。这些是现有工作流编排节点的具体案例。",
      "targetNode": "workflow-orchestration",
      "nodeScores": null,
      "coreCandidate": false,
      "coreScores": null,
      "evidenceRefs": [
        {
          "start": 12.9,
          "end": 26.76
        },
        {
          "start": 82,
          "end": 99.96
        },
        {
          "start": 190.86,
          "end": 204.02
        },
        {
          "start": 1157.84,
          "end": 1170.98
        }
      ],
      "nearestNodes": [],
      "proposedEdges": [],
      "externalSources": [],
      "claims": [],
      "proposedLearningPath": null,
      "disqualifiers": [],
      "proposedNode": null
    },
    {
      "term": "llm",
      "decision": "supplement",
      "rationale": "视频明确把聊天模型作为 AI 节点和 Agent 必须连接的推理核心，并展示在流程中选择模型提供方和凭据的应用位置。它提供的是现有 LLM 节点在自动化流程中的实践侧面，而不是独立的新概念。",
      "targetNode": "llm",
      "nodeScores": null,
      "coreCandidate": true,
      "coreScores": {
        "learningGateway": 4,
        "graphCentrality": 0,
        "crossRouteReuse": 4,
        "beginnerNavigation": 4,
        "stability": 4
      },
      "evidenceRefs": [
        {
          "start": 444.68,
          "end": 472.72
        },
        {
          "start": 786.76,
          "end": 801.08
        }
      ],
      "nearestNodes": [],
      "proposedEdges": [],
      "externalSources": [],
      "claims": [],
      "proposedLearningPath": null,
      "disqualifiers": [],
      "proposedNode": null
    },
    {
      "term": "mcp",
      "decision": "reject",
      "rationale": "MCP 只在可选工具类型列表中与 HTTP 和应用工具并列出现，视频没有解释协议身份、角色、传输、连接机制或实际调用过程，证据不足以形成地图补充。",
      "targetNode": null,
      "nodeScores": null,
      "coreCandidate": false,
      "coreScores": null,
      "evidenceRefs": [
        {
          "start": 856.64,
          "end": 862.64
        }
      ],
      "nearestNodes": [],
      "proposedEdges": [],
      "externalSources": [],
      "claims": [],
      "proposedLearningPath": null,
      "disqualifiers": [
        "仅在产品工具列表中顺带提及",
        "缺少 MCP 机制或用途解释"
      ],
      "proposedNode": null
    }
  ]
}
